Sheet: Frontend
A2: at ADC | B2: 0.75 | C2: 0.75 | D2: 0.75 | F2: 0.75 | G2: 0.75 | H2: 0.75
A4: VGAIN | B4: 50 | C4: 1 | D4: of:=[.$C4] -> 1 | F4: of:=[.B4] -> 50 | G4: of:=[.C4] -> 1 | H4: of:=[.D4] -> 1
A5: before VGAIN | B5: of:=[.B2]/[.B4] -> 0.015 | C5: of:=[.C2] / [.C4] -> 0.75 | D5: of:=[.D2] / [.D4] -> 0.75 | F5: of:=[.F2]/[.F4] -> 0.015 | G5: of:=[.G2] / [.G4] -> 0.75 | H5: of:=[.H2] / [.H4] -> 0.75
A7: Attenuator 2 | B7: 1 | C7: of:=[.$B7] -> 1 | D7: 0.1 | F7: of:=[.B7] -> 1 | G7: of:=[.C7] -> 1 | H7: of:=[.D7] -> 0.1
A8: before Attenuator 2 | B8: of:=[.B5]/[.B7] -> 0.015 | C8: of:=[.C5] / [.C7] -> 0.75 | D8: of:=[.D5] / [.D7] -> 7.5 | F8: of:=[.F5]/[.F7] -> 0.015 | G8: of:=[.G5] / [.G7] -> 0.75 | H8: of:=[.H5] / [.H7] -> 7.5
A10: Preamp | B10: 1 | C10: of:=[.$B10] -> 1 | D10: of:=[.$B10] -> 1 | F10: of:=[.$B10] -> 1 | G10: of:=[.$B10] -> 1 | H10: of:=[.$B10] -> 1
A11: before Preamp | B11: of:=[.B8]/[.B10] -> 0.015 | C11: of:=[.C8] / [.C10] -> 0.75 | D11: of:=[.D8] / [.D10] -> 7.5 | F11: of:=[.F8]/[.F10] -> 0.015 | G11: of:=[.G8] / [.G10] -> 0.75 | H11: of:=[.H8] / [.H10] -> 7.5
A13: Attenuator 1 | B13: of:=1/4 -> 0.25 | C13: of:=[.$B13] -> 0.25 | D13: of:=[.$B13] -> 0.25 | F13: of:=[.$B13] -> 0.25 | G13: of:=[.$B13] -> 0.25 | H13: of:=[.$B13] -> 0.25
A14: before Attenuator 1 | B14: of:=[.B11]/[.B13] -> 0.06 | C14: of:=[.C11] / [.C13] -> 3 | D14: of:=[.D11] / [.D13] -> 30 | F14: of:=[.F11]/[.F13] -> 0.06 | G14: of:=[.G11] / [.G13] -> 3 | H14: of:=[.H11] / [.H13] -> 30
A16: Probe | B16: 1 | C16: of:=[.$B16] -> 1 | D16: of:=[.$B16] -> 1 | F16: 0.1 | G16: of:=[.$F16] -> 0.1 | H16: of:=[.$F16] -> 0.1
A17: before Probe | B17: of:=[.B14]/[.B16] -> 0.06 | C17: of:=[.C14] / [.C16] -> 3 | D17: of:=[.D14] / [.D16] -> 30 | F17: of:=[.F14]/[.F16] -> 0.6 | G17: of:=[.G14] / [.G16] -> 30 | H17: of:=[.H14] / [.H16] -> 300